ticker,name,price,marketcap,volume,volumeavg,priceopen,low,high,close,change,changepct,closeyest,date,high52,low52,beta,shares,pe,eps,sector,industry,description,exchange,ceo,country,ipodate,isetf,isfund,isactive,web_url,image,currency,employees,city,state,phone,address,dividend_yield,fetched_at,profile_fetched_at,asset_class
ICLR,ICON Public Limited Company,142.789993,10531069952,578035,1153884,136.789993,135.520004,143.392502,142.789993,5.25,3.817072,137.539993,2026-06-03,,,1.227,76567325,47.42758,2.9,Healthcare,Diagnostics & Research,"ICON Public Limited Company, a clinical research organization, provides outsourced development and commercialization services in Ireland, rest of Europe, the United States, and internationally. The company specializes in the strategic development, management, and analysis of programs that support various stages of the clinical development process from compound selection to Phase I-IV clinical studies. It also provides clinical development services, including all phases of development, peri and post approval, data solutions, and site and patient access services; clinical trial management, consulting, and contract staffing services; and commercial services comprising clinical development strategy, planning and trial design, full study execution, and post-market commercialization. In addition, the company offers laboratory services, including bionanalytical, biomarker, vaccine, good manufacturing practice, and central laboratory services, as well as full-service and functional service partnerships to customers. Further, the company provides adaptive trials, cardiac safety solutions, clinical and scientific operations, consulting and advisory, commercial positioning, decentralized and hybrid clinical trials, early clinical, laboratories, language services, medical imaging, real world intelligence, site and patient, and strategic solutions. It serves pharmaceutical, biotechnology, and medical device industries, as well as government and public health organizations. The company has a strategic alliance with Advarra, Inc. for the development of a connected, research-ready clinical trial site network model. ICON Public Limited Company was incorporated in 1989 and is headquartered in Dublin, Ireland.",NMS,Mr. Barry  Balfe,Ireland,,false,false,true,https://www.iconplc.com,,USD,40100,Dublin,,353 1 291 2000,South County Business Park,,2026-06-03T18:02:06+00:00,2026-06-03T12:00:20+00:00,Equity
CRL,"Charles River Laboratories International, Inc.",179.409897,8419236864,269970,900541,172.75,169.600006,179.990005,179.409897,4.619904,2.643117,174.789993,2026-06-03,,,1.446,48167730,,-3.71,Healthcare,Diagnostics & Research,"Charles River Laboratories International, Inc. provides drug discovery, non-clinical development, and safety testing services in the United States, Europe, Canada, the Asia Pacific, and internationally. The Research Models and Services segment produces and sells rodents, and purpose-bred rats and mice for use by researchers. This segment also provides a range of services to assist its clients in supporting the use of research models in research and screening pre-clinical drug candidates, including genetically engineered models and services, insourcing solutions, and research animal diagnostic services; and engages in development and production of cell therapies. The Discovery and Safety Assessment segment offers in vitro and in vivo discovery services for the discovery, development, and safety testing of novel drugs, molecule compounds, oligonucleotides, and biotherapeutics, and antibodies through delivery of preclinical drug and therapeutic candidates ready for safety assessment; safety assessment services, such as toxicology, pathology, safety pharmacology, bioanalysis, drug metabolism, and pharmacokinetics services; and vivarium space services. The Manufacturing Solutions segment provides in vitro methods for conventional and rapid quality control testing of sterile and non-sterile pharmaceuticals and consumer products; offers specialized testing of biologics that are outsourced by pharmaceutical and biotechnology companies; and contract development and manufacturing products and services. The company has strategic collaborations with Parker Institute for Cancer Immunotherapy and Children's Hospital Los Angeles across its contract development and manufacturing organization. Additionally, it has a strategic alliance with Francis Crick Institute (Crick), Inc. for the development of Antibody-Drug Conjugate (ADC) drug discovery and development. Charles River Laboratories International, Inc. was founded in 1947 and is headquartered in Wilmington, Massachusetts.",NYQ,Ms. Birgit  Girshick,United States,,false,false,true,https://www.criver.com,,USD,18300,Wilmington,MA,781 222 6000,251 Ballardvale Street,,2026-06-03T18:02:07+00:00,2026-06-03T12:00:21+00:00,Equity
OPCH,"Option Care Health, Inc.",20.125,3225345024,843010,2880176,20.540001,20.105,20.629999,20.125,-0.415001,-2.020452,20.540001,2026-06-03,,,0.675,157027504,16.046877,1.28,Healthcare,Medical Care Facilities,"Option Care Health, Inc. offers home and alternate site infusion services in the United States. The company provides anti-infective therapy and services; home infusion services to treat heart failure; home parenteral nutrition and enteral nutrition support services for numerous acute and chronic conditions, such as stroke, cancer, and gastrointestinal diseases; immunoglobulin infusion therapies for the treatment of immune deficiencies; and treatments for chronic inflammatory disorders, including crohn's disease, plaque psoriasis, psoriatic arthritis, rheumatoid arthritis, ulcerative colitis, and other chronic inflammatory disorders. It also offers treatments to manage the progression of neurological disorders, such as Duchenne muscular dystrophy, multiple sclerosis, Alzheimer's disease, and other neurological disorder; infusion therapies for bleeding disorders, such as hemophilia and von Willebrand diseases; therapies for women with high-risk pregnancies; and other infusion therapies to treat various conditions, including pain management, chemotherapy, and respiratory medications, as well as nursing services. The company markets its services through patient referrals, including physicians, hospital discharge planners, hospital personnel, health maintenance organizations, and preferred provider organizations. The company is headquartered in Bannockburn, Illinois.",NMS,Mr. John Charles Rademacher,United States,,false,false,true,https://optioncarehealth.com,,USD,6528,Bannockburn,IL,312 940 2443,3000 Lakeside Drive,,2026-06-03T18:02:07+00:00,2026-06-03T12:00:22+00:00,Equity
IBB,iShares Biotechnology ETF,166.815002,,676107,1524465,163.619995,163.369995,167.100006,166.815002,2.544998,1.549277,164.270004,2026-06-03,,,,69700000,21.780321,,,,"The fund generally will invest at least 80% of its assets in the component securities of its underlying index and may invest up to 20% of its assets in certain futures, options and swap contracts, cash and cash equivalents. It is non-diversified.",NGM,,,,true,false,true,,,USD,,,,415-670-2000,,0.23,2026-06-03T18:02:08+00:00,2026-06-03T12:00:23+00:00,Equity
ESTC,Elastic N.V.,63.990002,6995632640,1046009,2118165,66.309998,63.840099,66.902802,63.990002,-3.599995,-5.326224,67.589996,2026-06-03,,,0.885,103501008,19.705538,3.43,Technology,Software - Application,"Elastic N.V., a search artificial intelligence (AI) company, provides software platforms to run in hybrid, public or private clouds, and multi-cloud environments in the United States and internationally. It primarily offers Elastic's Search AI Platform, a set of software products that ingest and store data from various sources and formats, as well as performs search, analysis, and visualization on that data. The company also provides Elastic search product a distributed, real-time vector database and analytics engine and data store for all types of data, including textual, numerical, geospatial, structured, and unstructured; Kibana, a user interface, management, and configuration interface for the platforms; Elasticsearch search platform, a platform with retrieval algorithms and the ability to integrate with large language models; and elastic security, a security solution that provides unified protection to prevent, detect, and respond to threats. In addition, it offers Elastic Observability, a solution that enables unified analysis, including Logs analytics to search and analyze petabytes of structured and unstructured logs; infrastructure monitoring to gain visibility across cloud, on-premises, Kubernetes, serverless, and hosts; Application Performance Monitoring to stream native production-grade; digital experience monitoring; and large language models. The company was incorporated in 2012 and is based in Amsterdam, the Netherlands.",NYQ,Mr. Ashutosh  Kulkarni,Netherlands,,false,false,true,https://www.elastic.co,,USD,,Amsterdam,,,Keizersgracht 281,,2026-06-03T18:02:10+00:00,2026-06-03T12:00:24+00:00,Equity
GTLB,GitLab Inc.,30.915001,5372865536,13066015,6608501,30.83,29.25,31.690001,30.915001,-0.904999,-2.844119,31.82,2026-06-03,,,,152478438,,-0.15,Technology,Software - Infrastructure,"GitLab Inc., together with its subsidiaries, develops software for the software development lifecycle in the United States, Europe, and the Asia Pacific. The company provides GitLab, an intelligent orchestration platform for DevSecOps, which is a single application offering the entire software development lifecycle, including software, project plans, code, security scans, compliance checks, and deployment configurations. It also offers the GitLab Duo Agent Platform, which enables intelligent orchestration of teams and AI agents to execute tasks autonomously across planning, development, security, and deployment. This platform combines conversational AI assistance, purpose-built agents for specialized tasks, workflow automation, and enterprise controls. In addition, it offers related training and professional services. The company was formerly known as GitLab B.V. and changed its name to GitLab Inc. in July 2015. GitLab Inc. was founded in 2011 and is based in San Francisco, California.",NMS,Mr. Sytse  Sijbrandij,United States,2021-10-14,false,false,true,https://about.gitlab.com,,USD,2580,San Francisco,CA,650 474 5175,268 Bush Street,,2026-06-03T18:02:10+00:00,2026-06-03T12:00:25+00:00,Equity
AI,"C3.ai, Inc.",10.52,1624355840,7103454,5074347,11.03,10.31,11.04,10.52,-0.66,-5.903397,11.18,2026-06-03,,,1.987,141791230,,-3.16,Technology,Software - Infrastructure,"C3.ai, Inc. operates as an enterprise artificial intelligence application software company. The company offers C3 agentic AI platform, an application development and runtime environment that enables customers to design, develop, and deploy enterprise AI applications; C3 AI CRM Suite, a customer relationship management solution; C3 Generative AI that enables to locate, retrieve, present information, disparate data stores, applications, and enterprise information systems; C3 AI Health Suite to accelerate healthcare innovation; and C3 AI Financial Services Suite. Its C3 AI Applications include C3 AI Asset Performance suite, which consists of C3 AI Reliability, C3 AI Process Optimization, and C3 AI Energy Management applications. The company's C3 AI Supply Chain Suite comprises C3 AI Supply Network Risk, C3 AI Inventory Optimization, C3 AI Demand Forecasting, C3 AI Production Schedule Optimization, and C3 AI Sourcing Optimization solutions; C3 AI Sustainability Suite includes C3 AI ESG and C3 AI Energy Management applications to decrease greenhouse gas emissions; and C3 AI Defense & Intelligence Suite. It provides C3 AI State and Local Government Suite that includes various applications, such as C3 Law Enforcement for state, county, and municipal law enforcement agencies; C3 AI Residential Property Appraisal and C3 AI Commercial Property Appraisal for county property assessors and appraisers; and C3 Generative AI for Government Programs and C3 Generative AI for Constituent Services for federal, state, and local governments. It has strategic partnerships with Microsoft Azure, AWS, Google Cloud, McKinsey & Company, Baker Hughes, Booz Allen, and others. The company has a strategic alliance with SMX Group, LLC for the development of mission critical AI in the secure environments. The company was formerly known as C3 IoT, Inc. and changed its name to C3.ai, Inc. in June 2019. C3.ai, Inc. was incorporated in 2009 and is headquartered in Redwood City, California.",NYQ,Mr. Thomas M. Siebel,United States,2020-12-09,false,false,true,https://www.c3.ai,,USD,1181,Redwood City,CA,650 503 2200,1400 Seaport Boulevard,,2026-06-03T18:02:12+00:00,2026-06-03T12:00:26+00:00,Equity
PATH,"UiPath, Inc.",11.735,6339000832,22801037,34399528,12.18,11.5111,12.24,11.735,-0.445001,-3.653536,12.18,2026-06-03,,,0.909,455752691,20.3,0.6,Technology,Software - Infrastructure,"UiPath, Inc. provides an automation platform that offers a range of robotic process automation (RPA) solutions primarily in the United States, Romania, the United Kingdom, the Netherlands, and internationally. It offers the UiPath platform, an integrated enterprise software platform that enables AI agents, robots, people, and models to work together in coordinated workflows. The company's UiPath platform includes the UiPath Maestro process orchestration and process intelligence; UiPath agent builder; RPA and API automation; UiPath intelligent xtraction and processing; UiPath test cloud for testing and quality assurance; UiPath packaged and prebuilt agentic solutions; and centralized governance capabilities that apply across automations, AI agents, and manual tasks. It serves the financial services, healthcare, manufacturing, retail, and public sectors. The company was founded in 2005 and is headquartered in New York, New York.",NYQ,Mr. Daniel Solomon Dines,United States,,false,false,true,https://www.uipath.com,,USD,3981,New York,NY,844 432 0455,One Vanderbilt Avenue,,2026-06-03T18:02:13+00:00,2026-06-03T12:00:26+00:00,Equity
DUOL,"Duolingo, Inc.",105.389999,5122912768,1104173,1908046,109.510002,104.610001,112.215401,105.389999,-4.559998,-4.147338,109.949997,2026-06-03,,,0.9,40237065,12.580091,8.74,Technology,Software - Application,"Duolingo, Inc. operates as a mobile learning platform in the United States, the United Kingdom, and internationally. The company offers 250 language courses, including Spanish, English, French, German, Italian, Portuguese, Japanese, and Chinese through its Duolingo app. It also provides a digital English language proficiency assessment exam. The company was incorporated in 2011 and is headquartered in Pittsburgh, Pennsylvania.",NMS,Dr. Luis Alfonso von Ahn Arellano Ph.D.,United States,2021-07-28,false,false,true,https://www.duolingo.com,,USD,900,Pittsburgh,PA,412 567 6602,5900 Penn Avenue,,2026-06-03T18:02:13+00:00,2026-06-03T12:00:27+00:00,Equity
CHGG,"Chegg, Inc.",1.265,150024848,1034961,1874257,1.33,1.24,1.3683,1.265,-0.075,-5.597018,1.34,2026-06-03,,,2.119,111958838,,-0.79,Consumer Defensive,Education & Training Services,"Chegg, Inc. provides a learning platform helping businesses bring new skills to their workforce and giving lifelong learners and students the skills and confidence to succeed in the United States and internationally. Its subscription services include Chegg Study, which offers personalized step-by-step learning support from AI, computational engines, and subject matter experts; Chegg Writing that provides students with a suite of tools, such as plagiarism detection scans, grammar and writing fluency checking, expert personalized writing feedback, and premium citation generation; Chegg Math provides a computational engine to help them understand and solve math problems; Chegg Study Pack, a bundle of various subscription product offerings, including Chegg Study, Chegg Writing, and Chegg Math services. The company also provides a skills-based learning platform to learn technical skills comprising AI, coding, data analytics, and cybersecurity. In addition, it rents and sells print textbooks and eTextbooks; and offers advertising services. The company serves students and companies through direct marketing channels and social media. Chegg, Inc. was incorporated in 2005 and is headquartered in Santa Clara, California.",NYQ,Mr. Daniel Lee Rosensweig,United States,,false,false,true,https://www.chegg.com,,USD,564,Santa Clara,CA,408 855 5700,3990 Freedom Circle,,2026-06-03T18:02:14+00:00,2026-06-03T12:00:28+00:00,Equity
TDOC,"Teladoc Health, Inc.",7.16,1361068672,2901849,4960365,7.4,6.96,7.401,7.16,-0.38,-5.039789,7.54,2026-06-03,,,2.081,180513087,,-0.97,Healthcare,Health Information Services,"Teladoc Health, Inc. provides virtual healthcare services worldwide. It operates through Teladoc Health Integrated Care and BetterHelp segments. The Integrated Care segment offers virtual medical services, including general medical, expert medical services, specialty medical, chronic condition management, and mental health services, as well as technologies and enterprise telehealth solutions for hospitals and health systems. Its BetterHelp segment operates a mental health platform that provides online counselling and therapy services through websites, mobile applications, phones, and text-based interactions by its licensed clinicians. The company offers its products and services under the Teladoc and BetterHelp brands. It serves employers, health plans, hospitals and health systems, insurance companies, and financial services companies, as well as individual members. The company was formerly known as Teladoc, Inc. and changed its name to Teladoc Health, Inc. in August 2018. Teladoc Health, Inc. was incorporated in 2002 and is headquartered in New York, New York.",NYQ,"Mr. Charles  Divita III, CPA",United States,,false,false,true,https://www.teladochealth.com,,USD,4648,New York,NY,203 635 2002,155 E 44th Street,,2026-06-03T18:02:15+00:00,2026-06-03T12:00:28+00:00,Equity
SONY,Sony Group Corporation,22.245001,134644719616,2198133,6255420,22.51,22.139999,22.530001,22.245001,-0.545,-2.3914,22.790001,2026-06-03,,,0.719,5908061149,21.101852,1.08,Technology,Consumer Electronics,"Sony Group Corporation designs, develops, produces, and sells electronic equipment, instruments, and devices for the consumer, professional, and industrial markets in Japan, the United States, Europe, China, the Asia-Pacific, and internationally. The company distributes software titles and add-on content through digital networks; network services related to game, video, and music content; hardware and home gaming consoles, packaged and game software, and peripheral devices. It also develops, produces, markets, and distributes recorded music; publishes music; and produces and distributes animation titles, game applications, and various services for music and visual products. In addition, the company produces, acquires, and distributes live-action and animated motion pictures for theatrical release, as well as scripted and animated series, unscripted reality or light entertainment, daytime serials, game shows, television movies, and miniseries and other television programs; operation of television networks and direct-to-consumer streaming services; operates a visual effects and animation unit; and manages a studio facility. Further, the company researches, develops, designs, produces, markets, distributes, sells, and services televisions, and video and sound products; interchangeable lens, as well as compact digital, and consumer and professional video cameras; projectors and medical equipment; mobile phones, accessories, and applications; and metal oxide semiconductor image sensors, integration systems, and other semiconductors. Additionally, it offers internet broadband network services; recording media, and storage media products; and life and non-life insurance, banking, and other services, as well as creates and distributes content for PCs and mobile phones. The company has a strategic partnership with TCL Electronics Holdings Limited. The company was formerly known as Sony Corporation and changed its name to Sony Group Corporation in April 2021. Sony Group Corpo",NYQ,Mr. Kenichiro  Yoshida,Japan,,false,false,true,https://www.sony.com,,USD,,Tokyo,,81-3-6748-2111,1-7-1 Konan Minato-ku,0.7,2026-06-03T18:02:16+00:00,2026-06-03T12:00:30+00:00,Equity
WMG,Warner Music Group Corp.,29.67,16065757184,2325839,2449707,30.620001,28.620001,30.66,29.67,-1.129999,-3.668829,30.799999,2026-06-03,,,1.251,146235215,36.666668,0.84,Communication Services,Entertainment,"Warner Music Group Corp. operates as a music entertainment company in the United States, the United Kingdom, Germany, and internationally. It operates through Recorded Music and Music Publishing segments. The company is involved in the discovery and development of recording artists, as well as related marketing, promotion, distribution, sale, and licensing of music created by recording artists; markets its music catalog through compilations and reissuances of previously released music and video titles, as well as previously unreleased materials. It also owns and acquires rights to approximately two million musical compositions comprising pop hits, American standards, folk songs, and motion picture and theatrical compositions, as well as administers the music and soundtracks of various third-party television and film producers and studios. In addition, the company conducts its operation primarily through a collection of record labels, such as Asylum, Big Beat, Canvasback, East West, Erato, FFRR, Nonesuch, Parlophone, Reprise, Sire, Spinnin' Records, and Warner Classics and Warner Records Nashville. Further, it markets, distributes, and sells music and video products to retailers and wholesale distributors; independent labels to retail and wholesale distributors; and various distribution centers and ventures, as well as retail outlets, online physical retailers, streaming services, and download services. Its catalog includes songwriters and composers; and various genres, including pop, rock, jazz, classical, country, R&B, hip-hop, rap, reggae, Latin, folk, alternative, blues, gospel, and other Christian music. The company was founded in 1929 and is headquartered in New York, New York.",NMS,Mr. Robert  Kyncl,United States,2020-06-03,false,false,true,https://www.wmg.com,,USD,5500,New York,NY,212 275 2000,1633 Broadway,2.47,2026-06-03T18:02:18+00:00,2026-06-03T12:00:31+00:00,Equity
ROKU,"Roku, Inc.",121.894997,18774829056,1357869,2568996,125.730003,119.489998,126.989998,121.894997,-5.225006,-4.110294,127.120003,2026-06-03,,,2.043,131191687,94.162964,1.35,Communication Services,Entertainment,"Roku, Inc., together with its subsidiaries, operates a TV streaming platform in the United States and internationally. The company operates in two segments, Platform and Devices. Its streaming platform allows users to find and access TV shows, movies, news, sports, and others, as well as offers digital advertising services. The company also sells streaming players, Roku-branded TVs, smart home products and services, audio products, and related accessories. Roku, Inc. was incorporated in 2002 and is headquartered in San Jose, California.",NMS,Mr. Anthony J. Wood,United States,,false,false,true,https://www.roku.com,,USD,3600,San Jose,CA,408 556 9040,1173 Coleman Avenue,,2026-06-03T18:02:19+00:00,2026-06-03T12:00:32+00:00,Equity
IMAX,IMAX Corporation,38.865002,2228143616,423082,1133112,40.299999,38.700001,40.630001,38.865002,-1.634998,-4.037033,40.5,2026-06-03,,,0.364,55015891,60.44776,0.67,Communication Services,Entertainment,"IMAX Corporation, together with its subsidiaries, operates as a technology platform for entertainment and events in the United States, Canada, Greater China, rest of Asia, Western Europe, Latin America, and internationally. It operates through Content Solutions; and Technology Products and Services segments. The company offers IMAX film remastering, a proprietary technology that digitally remasters films and other content into IMAX formats for distribution to the IMAX network; IMAX Enhanced, which provides end-to-end technology across streaming content and entertainment devices at home; AI-driven video quality solutions for media and entertainment companies; and streaming technology software products. It also provides preventative and emergency maintenance services, and quality monitoring to the IMAX network; film post-production services; and IMAX film and digital cameras for content creators. In addition, the company engages in the distribution of format documentary films to institutional theaters, as well as live performances and interactive events with artists and creators; after-market sales of IMAX System parts and 3D glasses; sale or lease of IMAX theater systems; provision of management services to theaters; and rental of company's proprietary 2D and 3D large-format film cameras. The company markets its theater systems through a direct sales force and marketing staff to science and natural history museums, zoos, aquariums, and other educational and cultural centers, as well as theme parks, private home theaters, tourist destination sites, fairs, and expositions. It offers its services under the IMAX, IMAX 3D, Experience It In IMAX, The IMAX Experience, DMR, Filmed For IMAX, IMAX Live, IMAX Enhanced, and IMAX StreamSmart. IMAX Corporation was founded in 1967 and is headquartered in Mississauga, Canada.",NYQ,Mr. Richard Lewis Gelfond J.D.,Canada,,false,false,true,https://www.imax.com,,USD,679,Mississauga,ON,905 403 6457,2525 Speakman Drive,,2026-06-03T18:02:19+00:00,2026-06-03T12:00:33+00:00,Equity
