ticker,name,price,marketcap,volume,volumeavg,priceopen,low,high,close,change,changepct,closeyest,date,high52,low52,beta,shares,pe,eps,sector,industry,description,exchange,ceo,country,ipodate,isetf,isfund,isactive,web_url,image,currency,employees,city,state,phone,address,dividend_yield,fetched_at,profile_fetched_at,asset_class
TW,Tradeweb Markets Inc.,100.190002,21857107968,2700600,1488553,100.470001,99.809998,104.290001,100.190002,-0.059998,-0.059848,100.25,2026-06-02,,,0.667,116035961,24.753086,4.05,Financial Services,Capital Markets,"Tradeweb Markets Inc. builds and operates electronic marketplaces in the United States and internationally. The company offers marketplaces that facilitate trading products across various asset classes, including rates, credit, equities, and money markets. It also provides pre-trade data and analytics, such as AI-Price, SNAP+, iNAV for ETFs, integrations, and LSEG market data; and trade execution comprising request-for-quote, request-for-market, request-for-stream, list trading, compression, blast all-to-all, click-to-trade, portfolio trading, session-based, central limit order book, bilateral firm streams, inventory-based, rematch, voice, futures vs. cash spreading, and dealer algorithmic suite. In addition, the company offers trade processing; and post-trade data, analytics, and reporting, which include transaction cost analysis, benchmark prices, and APA. It serves institutional, wholesale, retail, and corporate clients, such as asset managers, hedge funds, insurance companies, central banks, banks and dealers, proprietary trading firms, retail brokerage and financial advisory firms, regional dealers, and corporations. The company was founded in 1996 and is headquartered in New York, New York. Tradeweb Markets Inc. is a subsidiary of Refinitiv Parent Limited.",NMS,Mr. William E. Hult,United States,,false,false,true,https://www.tradeweb.com,,USD,1598,New York,NY,646 430 6000,245 Park Avenue,0.56,2026-06-02T05:14:10+00:00,2026-06-01T05:28:19+00:00,Equity
BK,Bank of New York Mellon Corp,142.589996,94143750144,3249037,3628666,138.600006,137.5,143.25,142.589996,3.160004,2.266373,139.429993,2026-06-02,,,1.068,686379000,17.01737,8.06,Financial Services,Banks - Diversified,"The Bank of New York Mellon Corporation provides a range of financial products and services in the United States and internationally. It operates through Securities Services, Market and Wealth Services, Investment and Wealth Management, and Other segments. The Securities Services segment offers custody, trust and depositary, accounting, exchange-traded funds, middle-office solutions, transfer agency, services for private equity and real estate funds, foreign exchange, securities lending, liquidity/lending services, and data analytics. This segment also provides trustee, paying agency, fiduciary, escrow and other financial, issuer, and support services for brokers and investors. The Market and Wealth Services segment offers clearing and custody, investment, wealth and retirement solutions, technology and enterprise data management, trading, and prime brokerage services. This segment also provides integrated cash management solutions, including payments, foreign exchange, liquidity management, receivables processing, payables management, and trade finance, as well as U.S. government and global clearing, and tri-party services. The Investment and Wealth Management segment offers investment management strategies, investment products distribution, investment management, custody, wealth and estate planning, private banking, investment, and information management services. The Other segment provides corporate treasury, derivative and other trading, corporate and bank-owned life insurance, tax credit investment, other corporate investment, and business exit services. The company serves central banks and sovereigns, financial institutions, asset managers, insurance companies, corporations, local authorities and high net-worth individuals, and family offices. The Bank of New York Mellon Corporation was founded in 1784 and is headquartered in New York, New York.",NYQ,Mr. Robin Antony Vince,United States,77463000,false,false,true,https://www.bny.com,,USD,47200,New York,NY,212 495 1784,240 Greenwich Street,0.0153,2026-06-02T05:14:11+00:00,2026-06-01T05:28:20+00:00,Equity
STT,State Street Corporation,159.789993,43076022272,1321400,2121555,155.339996,155.089996,160.080002,159.789993,4.149994,2.666406,155.639999,2026-06-02,,,1.46,276767033,15.801015,9.85,Financial Services,Asset Management,"State Street Corporation provides various financial products and services to institutional investors. It offers custody, accounting, and fund administration services for traditional and alternative assets, as well as multi-asset class investments; recordkeeping, client reporting, and investment book of record, transaction management, loans, cash, derivatives, and collateral services; investor services operations outsourcing; performance, risk, and compliance analytics; financial data management to support institutional investors; foreign exchange, brokerage, and other trading services; securities finance, such as prime services products; and deposit and short-term investment facilities. 
The company also provides the State Street Alpha platform that combines portfolio management, trading and execution, analytics and compliance tools, and advanced data aggregation and integration with other industry platforms and providers; front-office technology that automates and simplifies the institutional investment process comprising portfolio management and risk analytics, trading, and post-trade settlement with integrated compliance and managed data; investment management solutions; and portfolio management, trading compliance, and manager/sponsor communication. In addition, it offers investment management solutions, such as strategies across equity, fixed income, cash, multi-asset, and alternatives; and ETFs, custom indexed, managed funds, and mandates. The company provides its products and services to mutual funds, collective investment funds and other investment pools, corporate and public retirement plans, insurance companies, wealth managers, investment managers, foundations, and endowments. The company was founded in 1792 and is headquartered in Boston, Massachusetts.",NYQ,Mr. Ronald Philip O'Hanley,United States,,false,false,true,https://www.statestreet.com,,USD,51503,Boston,MA,617 786 3000,One Congress Street,2.16,2026-06-02T05:14:11+00:00,2026-06-01T05:28:20+00:00,Equity
NTRS,Northern Trust Corporation,168.339996,30616070144,748200,1108842,164.289993,164.279999,169.360001,168.339996,2.889999,1.746751,165.449997,2026-06-02,,,1.286,185047258,17.324606,9.55,Financial Services,Asset Management,"Northern Trust Corporation, a financial holding company, provides wealth management, asset servicing, asset management, and banking solutions for corporations, institutions, families, and individuals. It operates in two segments, Asset Servicing and Wealth Management. The Asset Servicing segment offers asset servicing and related services, including custody, fund administration, investment operations outsourcing, investment management, investment risk and analytical, employee benefit, securities lending, foreign exchange, treasury management, brokerage, transition management, banking, and cash management services. It serves corporate and public retirement funds, foundations, endowments, fund managers, insurance companies, sovereign wealth funds, and other institutional investors. The Wealth Management segment offers trust, investment management, custody, and philanthropic; financial consulting; guardianship and estate administration; family business consulting; family financial education; brokerage; and private and business banking services. This segment also provides global custody; fiduciary; family office consulting; and technology solutions to high-net-worth individuals and families, business owners, executives, professionals, retirees, and established privately-held businesses. In addition, it offers asset management, and related services and other products comprising active and passive equity; active and passive fixed income; cash management; muti-asset and alternative asset classes which includes private equity and hedge funds of funds; and multi-manager advisory services and products through separately managed accounts, bank common and collective funds, registered investment companies, exchange traded funds, non-U.S. collective investment funds, and unregistered private investment funds. Further, the company provides overlay and other risk management services. The company was founded in 1889 and is headquartered in Chicago, Illinois.",NMS,Mr. Michael Gerard O'Grady,United States,,false,false,true,https://www.northerntrust.com,,USD,23600,Chicago,IL,312 630 6000,50 South La Salle Street,1.93,2026-06-02T05:14:12+00:00,2026-06-01T05:28:21+00:00,Equity
IBKR,"Interactive Brokers Group, Inc.",88.690002,147854065664,6860600,4911255,86.099998,85.019997,91.019997,88.690002,1.720001,1.977695,86.970001,2026-06-02,,,1.322,445484364,37.326183,2.33,Financial Services,Capital Markets,"Interactive Brokers Group, Inc. operates as an automated electronic broker in the United States and internationally. The company engages in the execution, clearance, and settlement of trades in stocks, options, futures, foreign exchange instruments, bonds, precious metals, and cryptocurrencies; and the company provides custody, prime brokerage, securities, and margin lending services. It also offers custody and service accounts for hedge and mutual funds, ETFs, registered investment advisors, proprietary trading groups, introducing brokers, and individual investors. In addition, the company provides trading platforms, including IBKR Trader Workstation, IBKR Desktop, IBKR Mobile, and IBKR Client Portal platform, as well as IBKR GlobalTrader mobile application, and IBKR APIs, builds custom trading applications and automates any part of the trading process. Further, it offers IBKR Pro, IBKR Lite, IBKR Universal Account, insured bank deposit sweep program, investors' marketplace, mutual fund marketplace, bond marketplace, forecast and event contracts, fractional trading, no transaction fee program for exchange-traded funds, overnight trading hours, and karta visa infinite charge card. It serves institutional and individual customers through electronic exchanges and market centers. Interactive Brokers Group, Inc. was founded in 1977 and is headquartered in Greenwich, Connecticut.",NMS,Mr. Thomas Pechy Peterffy,United States,,false,false,true,https://www.interactivebrokers.com,,USD,3232,Greenwich,CT,203 618 5800,One Pickwick Plaza,0.4,2026-06-02T05:14:12+00:00,2026-06-01T05:28:21+00:00,Equity
KKR,KKR & Co. Inc.,95.010002,89458442240,4028800,5945930,96.75,94.760002,98.790001,95.010002,-0.93,-0.969356,95.940002,2026-06-02,,,1.852,897872941,32.632652,2.94,Financial Services,Asset Management,"KKR & Co. Inc. is a private equity and real estate investment firm specializing in direct and fund of fund investments. It specializes in acquisitions, leveraged buyouts, management buyouts, credit special situations, growth equity, mature, mezzanine, distressed, turnaround, lower middle market, and middle market investments. The firm considers investments in all industries with a focus on software, cybersecurity, fintech, data and information, security, semiconductors, consumer electronics, internet of things (iot), internet, information services, information technology infrastructure, financial technology, network and cyber security architecture, engineering and operations, content, technology and hardware, energy and infrastructure, real estate, services industry with a focus on business services, intelligence, industry-leading franchises and companies in natural resource, containers and packaging, agriculture, airports, ports, forestry, electric utilities, textiles, apparel and luxury goods, household durables, digital media, insurance, brokerage houses, non-durable goods distribution, supermarket retailing, grocery stores, food, beverage, and tobacco, hospitals, entertainment venues and production companies, publishing, printing services, capital goods, financial services, specialized finance, pipelines, and renewable energy. In energy and infrastructure, it focuses on the upstream oil and gas and equipment, minerals and royalties and services verticals. In real estate, the firm seeks to invest in private and public real estate securities including property-level equity, debt and special situations transactions and businesses with significant real estate holdings, and oil and natural gas properties. The firm also invests in asset services sector that encompasses a broad array of B2B, B2C and B2G services verticals including asset-based, transport, logistics, leisure/hospitality, resource and utility support, infra-like, mission-critical, and environmental servi",NYQ,Mr. George R. Roberts J.D.,United States,,false,false,true,https://www.kkr.com,,USD,5043,New York,NY,212 750 8300,30 Hudson Yards,0.78,2026-06-02T05:14:12+00:00,2026-06-01T05:28:22+00:00,Equity
APO,"Apollo Global Management, Inc.",128.220001,74203570176,3086100,4718665,127.68,127.68,131.149994,128.220001,-0.490005,-0.380705,128.710007,2026-06-02,,,1.519,576517513,80.443756,1.6,Financial Services,Asset Management,"Apollo Global Management, Inc. is a private equity firm specializing in investments in credit, private equity, infrastructure, secondaries and real estate markets. The firm prefers to invest in private and public markets. The firm's private equity investments include traditional buyouts, recapitalization, distressed buyouts and debt investments in real estate, corporate partner buyouts, distressed asset, corporate carve-outs, middle market, growth, venture capital, turnaround, bridge, corporate restructuring, special situation, acquisition, and industry consolidation transactions. For credit strategies, the firm focuses to invest in multi-sector credit, semi-liquid credit, direct lending, first lien, unitranche, whole loans and private credit. The firm provides its services to endowment and sovereign wealth funds, as well as other institutional and individual investors. It manages client focused portfolios. The firm launches and manages hedge funds for its clients. It also manages real estate funds and private equity funds for its clients. The firm invests in the fixed income and alternative investment markets across the globe. Its fixed income investments include income-oriented senior loans, bonds, collateralized loan obligations, structured credit, opportunistic credit, non-performing loans, distressed debt, mezzanine debt, and value oriented fixed income securities. The firm seeks to invest in chemicals, commodities, consumer and retail, oil and gas, metals, mining, agriculture, commodities, distribution and transportation, financial and business services, manufacturing and industrial, media distribution, cable, entertainment and leisure, telecom, technology, natural resources, energy, packaging and materials, and satellite and wireless industries. It also focuses on clean energy, sustainable industry, climate solutions, energy transition, industrial decarbonization, sustainable mobility, sustainable resource use, and sustainable real estate. It seeks to invest ",NYQ,Mr. Marc Jeffrey Rowan,United States,,false,false,true,https://www.apollo.com/institutional/homepage,,USD,6140,New York,NY,212 515 3200,9 West 57th Street,1.75,2026-06-02T05:14:13+00:00,2026-06-01T05:28:22+00:00,Equity
TROW,"T. Rowe Price Group, Inc.",103.919998,22397288448,2508800,2317692,103.860001,103.43,105.669998,103.919998,-0.610001,-0.583565,104.529999,2026-06-02,,,1.532,214266606,11.215666,9.32,Financial Services,Asset Management,"T. Rowe Price Group, Inc. is a publicly owned investment manager. The firm provides its services to individuals, institutional investors, retirement plans, financial intermediaries, and institutions. It launches and manages equity and fixed income mutual funds. The firm invests in the public equity and fixed income markets across the globe. It employs fundamental and quantitative analysis with a bottom-up approach. The firm utilizes in-house and external research to make its investments. It employs socially responsible investing with a focus on environmental, social, and governance issues. It makes investment in late-stage venture capital transactions and usually invests between $3 million and $5 million. The firm was previously known as T. Rowe Group, Inc. and T. Rowe Price Associates, Inc. T. Rowe Price Group, Inc. was founded in 1937 and is based in Baltimore, Maryland, with additional offices in North America, Europe, Asia, Australia.",NMS,"Mr. Robert W. Sharps C.F.A., CPA",United States,,false,false,true,https://www.troweprice.com,,USD,7507,Baltimore,MD,410 345 2000,1307 Point Street,4.97,2026-06-02T05:14:13+00:00,2026-06-01T05:28:23+00:00,Equity
BEN,"Franklin Resources, Inc.",30.940001,16119144448,3752100,5060780,30.620001,30.610001,31.309999,30.940001,-0.08,-0.257898,31.02,2026-06-02,,,1.591,519637162,23.67939,1.31,Financial Services,Asset Management,"Franklin Resources, Inc. is a publicly owned asset investment manager. Through its subsidiaries, the firm provides its services to individuals, institutions, pension plans, trusts, and partnerships. It launches equity, fixed income, balanced, and multi-asset mutual funds through its subsidiaries. The firm invests in the public equity, fixed income, and alternative markets. Franklin Resources, Inc. was founded in 1947 and is based in San Mateo, California with an additional office in Calgary, Alberta; Dubai, United Arab Emirates; Edinburgh, Midlothian; Fort Lauderdale, Florida; Hyderabad, India; London, Greater London; Rancho Cordova, California; Shanghai, Shanghai Province; Singapore; Stamford, Connecticut; and Vienna.",NYQ,Mr. Gregory Eugene Johnson CPA,United States,,false,false,true,https://www.franklinresources.com,,USD,10000,San Mateo,CA,650-312-2000,One Franklin Parkway,4.26,2026-06-02T05:14:14+00:00,2026-06-01T05:28:24+00:00,Equity
IVZ,Invesco Ltd.,27.620001,12616221696,8460600,5472193,28.08,27.280001,28.5,27.620001,-0.839998,-2.951505,28.459999,2026-06-02,,,1.573,443296629,,-1.47,Financial Services,Asset Management,"Invesco Ltd. is a publicly owned investment manager. The firm provides its services to retail clients, institutional clients, high-net worth clients, public entities, corporations, unions, non-profit organizations, endowments, foundations, pension funds, financial institutions, and sovereign wealth funds. It manages separate client-focused equity and fixed income portfolios. The firm also launches equity, commodity, fixed income, multi-asset, and balanced mutual funds for its clients. It launches equity, fixed income, multi-asset, and balanced exchange-traded funds. The firm also launches and manages private funds. It invests in the public equity and fixed income markets across the globe. The firm prefers to invest between $5 million and $15 million in companies. The firm also invests in alternative markets, such as commodities and currencies. For the equity portion of its portfolio, it invests in growth and value stocks of large-cap, mid-cap, and small-cap companies. For the fixed income portion of its portfolio, the firm invests in convertibles, government bonds, municipal bonds, treasury securities, and cash. It also invests in short term and intermediate term bonds, investment grade and high yield bonds, taxable and tax-free bonds, senior secured loans, and structured securities such as asset-backed securities, mortgage-backed securities, and commercial mortgage-backed securities. The firm employs absolute return, global macro, and long/short strategies. It employs quantitative analysis to make its investments. The firm was formerly known as Invesco Plc, AMVESCAP plc, Amvesco plc, Invesco PLC, Invesco MIM, and H. Lotery & Co. Ltd. Invesco Ltd. was founded in 1935 and is based in Atlanta, Georgia with an additional office in Asia, Europe, Africa and North America.",NYQ,Mr. Andrew Ryan Schlossberg,United States,,false,false,true,https://www.invesco.com/corporate/en/home.html,,USD,7421,Atlanta,GA,404 892 0896,Midtown Union,3.02,2026-06-02T05:14:14+00:00,2026-06-01T05:28:24+00:00,Equity
URI,"United Rentals, Inc.",997.820007,62375297024,502400,572993,987.080017,974.210022,1001.659973,997.820007,2.150024,0.215937,995.669983,2026-06-02,,,1.831,62646557,25.44518,39.13,Industrials,Rental & Leasing Services,"United Rentals, Inc., through its subsidiaries, operates as an equipment rental company in the United States, Canada, Europe, Australia, and New Zealand. It operates through two segments, General Rentals and Specialty. The General Rentals segment rents general construction and industrial equipment, such as backhoes, skid-steer loaders, forklifts, earthmoving equipment, and material handling equipment; aerial work platforms, including boom and scissor lifts; and general tools and light equipment comprising pressure washers, water pumps, and power tools for construction and industrial companies, manufacturers, utilities, municipalities, homeowners, and government entities. The specialty segment rents trench safety equipment consists of trench shields, aluminum hydraulic shoring systems, slide rails, crossing plates, construction lasers, and line testing equipment for underground work; power and heating, ventilating, and air conditioning equipment, such as portable diesel generators, electrical distribution equipment, and temperature control equipment; fluid solutions equipment for fluid containment, transfer, and treatment; surface protection mats; and mobile storage equipment and modular office space. This segment serves construction companies involved in infrastructure projects, and municipalities and industrial companies. The company also sells aerial lifts, reach forklifts, telehandlers, compressors, and generators; construction consumables, tools, small equipment, and safety supplies; and parts for equipment that is owned by its customers, as well as provides repair and maintenance services. It sells used equipment through its sales force, brokers, website, at auctions, and directly to manufacturers. United Rentals, Inc. was incorporated in 1997 and is headquartered in Stamford, Connecticut.",NYQ,Mr. Matthew J. Flannery,United States,,false,false,true,https://www.unitedrentals.com,,USD,28500,Stamford,CT,203 622 3131,100 First Stamford Place,0.79,2026-06-02T05:14:14+00:00,2026-06-01T05:28:25+00:00,Equity
VMC,Vulcan Materials Company,281.559998,36710256640,1415500,1227253,278.690002,275.48999,284.200012,281.559998,-1.360016,-0.480707,282.920013,2026-06-02,,,1.091,129754885,33.561092,8.43,Basic Materials,Building Materials,"Vulcan Materials Company produces and supplies construction aggregates in the United States. It operates through three segments: Aggregates, Asphalt, and Concrete. The company provides crushed stone, sand and gravel, sand, and other aggregates for use in construction and maintenance of highways, streets, and other public works, as well as in the construction of housing and commercial, industrial, and other nonresidential facilities; aggregates that are used as ballast for construction and maintenance of railroad tracks; riprap and jetty stones for use in erosion control along roads and waterways; asphalt mix; asphalt construction paving services; and ready-mixed concrete products. The company was formerly known as Virginia Holdco, Inc. and changed its name to Vulcan Materials Company. Vulcan Materials Company was founded in 1909 and is headquartered in Birmingham, Alabama.",NYQ,Mr. James Thomas Hill,United States,,false,false,true,https://www.vulcanmaterials.com,,USD,11548,Birmingham,AL,205 298 3000,1200 Urban Center Drive,0.74,2026-06-02T05:14:15+00:00,2026-06-01T05:28:25+00:00,Equity
MLM,"Martin Marietta Materials, Inc.",570.960022,34925096960,635600,533314,570.580017,560.700012,573.080017,570.960022,-10.679993,-1.836186,581.640015,2026-06-02,,,1.136,60045900,36.489338,15.94,Basic Materials,Building Materials,"Martin Marietta Materials, Inc., a natural resource-based building materials company, supplies aggregates and heavy-side building materials to the construction industry in the United States and internationally. It operates through East Group and West Group segments. The company offers crushed stone, sand, and gravel products; ready mixed concrete and asphalt; and paving products and services for use in the infrastructure projects, and nonresidential and residential construction projects, as well as in the railroad, agricultural, utility, and environmental industries. It also produces magnesia-based chemicals products, and dolomitic lime primarily to customers for steel production and soil stabilization. Its chemical products are used in flame retardants, wastewater treatment, pulp and paper production, and other applications. The company was founded in 1939 and is based in Raleigh, North Carolina.",NYQ,Mr. C. Howard Nye J.D.,United States,,false,false,true,https://www.martinmarietta.com,,USD,9600,Raleigh,NC,919 781 4550,4123 Parklake Avenue,0.57,2026-06-02T05:14:15+00:00,2026-06-01T05:28:26+00:00,Equity
