ticker,name,price,marketcap,volume,volumeavg,priceopen,low,high,close,change,changepct,closeyest,date,high52,low52,beta,shares,pe,eps,sector,industry,description,exchange,ceo,country,ipodate,isetf,isfund,isactive,web_url,image,currency,employees,city,state,phone,address,dividend_yield,fetched_at,profile_fetched_at,asset_class
ADM,Archer-Daniels-Midland Company,82.620003,38450491392,2983000,4027546,79.720001,79.050003,82.830002,82.620003,2.840004,3.559794,79.779999,2026-06-02,,,0.578,481956527,35.61607,2.24,Consumer Defensive,Farm Products,"Archer-Daniels-Midland Company provides human and animal nutrition ingredients and solutions in the United States, Switzerland, the Cayman Islands, Brazil, Mexico, Canada, the United Kingdom, and internationally. It operates in three segments: Ag Services and Oilseeds; Carbohydrate Solutions; and Nutrition. The company engages in the origination, merchandising, transportation, and storage of agricultural raw materials, as well as the crushing and processing of oilseeds, including soybeans and soft seeds, such as cottonseed, sunflower seed, canola, rapeseed, and flaxseed; produces and markets vegetable oils and oilseed protein meals used by food, feed, energy, and industrial customers; sale of crude and partially refined vegetable oils; supplies peanuts and peanut-derived ingredients; and manufactures cotton cellulose pulp. It is also involved in the grain sourcing, handling, and multimodal transportation network supporting import, export, and distribution activities; structured trade finance activities; corn and wheat wet and dry milling and related processing activities; production of distillers' grains, corn gluten feed, and corn gluten meal for use as animal feed ingredients; and carbon capture and sequestration and other emissions-reduction initiatives. In addition, the company engages in the creation, manufacturing, sale, and distribution of an array of ingredients and solutions comprising plant-based proteins, flavors and colors derived from nature, flavor systems, emulsifiers, soluble fiber, polyols, hydrocolloids, probiotics, prebiotics, postbiotics, enzymes, botanical extracts, and other specialty food and feed ingredients and systems. Further, it is involved in the derivatives and commodity exchanges and clearing houses; and insurance coverage for certain property, casualty, marine, medical, and other miscellaneous risks. The company was founded in 1902 and is based in Chicago, Illinois.",NYQ,Mr. Juan Ricardo Luciano,United States,,false,false,true,https://www.adm.com,,USD,40798,Chicago,IL,312 634 8100,77 West Wacker Drive,2.61,2026-06-02T05:13:45+00:00,2026-06-01T05:27:44+00:00,Equity
BG,Bunge Global SA,129.970001,23922434048,2054300,1759090,123.949997,123.230003,130.619995,129.970001,6.669998,5.409569,123.300003,2026-06-02,,,0.627,194018115,32.44737,3.8,Consumer Defensive,Farm Products,"Bunge Global SA operates as an agribusiness and food company worldwide. It operates through four segments: Soybean Processing and Refining, Softseed Processing and Refining, Other Oilseeds Processing and Refining, and Grain Merchandising and Milling. The Soybean Processing and Refining segment is involved in the purchase, storage, transportation, processing, distribution, refining, marketing, and sale of soybeans and soybean related products, as well as biodiesel and fertilizer production and distribution for the food, animal feed and biofuel industries. The Softseed Processing and Refining segment is involved in the purchase, storage, transportation, processing, distribution, refining, marketing, and sale of softseeds and softseed related products, as well as biodiesel production and distribution. The Other Oilseeds Processing and Refining Segment is involved in products of a specialty nature, including the purchase, storage, transportation, processing, distribution, refining, marketing, and sale of these related products. The Grain Merchandising and Milling segment is involved in the purchase, storage, transportation, distribution, and marketing of commodities primarily consisting of corn, wheat, barley, cotton, pulses, and sugar; milling of wheat and sugar; and related services including ocean freight and financial services. Bunge Global SA was founded in 1818 and is headquartered in Chesterfield, Missouri.",NYQ,Mr. Gregory A. Heckman,United States,,false,false,true,https://www.bunge.com,,USD,34000,Chesterfield,MO,(314) 292-2000,1391 Timberlake Manor Parkway,2.34,2026-06-02T05:13:45+00:00,2026-06-01T05:27:44+00:00,Equity
TSN,"Tyson Foods, Inc.",59.93,21486936064,3617700,2883795,60.27,59.560001,60.790001,59.93,-1.09,-1.7863,61.02,2026-06-02,,,0.394,282120397,48.047245,1.27,Consumer Defensive,Farm Products,"Tyson Foods, Inc., together with its subsidiaries, operates as a food company worldwide. It operates through four segments: Beef, Pork, Chicken, and Prepared Foods. The company processes live fed cattle and hogs; fabricates dressed beef and pork carcasses into primal and sub-primal meat cuts, as well as case ready beef and pork, and fully cooked meats; raises and processes chickens into fresh, frozen, and value-added chicken products, including breaded chicken strips, nuggets, patties, and other ready-to-fix or fully cooked chicken parts; and supplies poultry breeding stock. It also manufactures and markets frozen and refrigerated food products, including ready-to-eat sandwiches, flame-grilled hamburgers, Philly steaks, pepperoni, bacon, breakfast sausage, turkey, lunchmeat, hot dogs, flour and corn tortilla products, appetizers, snacks, prepared meals, ethnic foods, side dishes, meat dishes, breadsticks, and processed meats under the Tyson, Jimmy Dean, Hillshire Farm, Ball Park, Wright, Aidells, Gallo Salame, ibp, and State Fair brands. The company sells its products through its sales staff to grocery retailers, grocery wholesalers, meat distributors, warehouse club stores, military commissaries, industrial food processing companies, chain restaurants or their distributors, live markets, international export companies, and domestic distributors who serve restaurants and food service operations, such as plant and school cafeterias, convenience stores, hospitals, and other vendors, as well as through independent brokers and trading companies. Tyson Foods, Inc. was founded in 1935 and is headquartered in Springdale, Arkansas.",NYQ,Mr. Donnie D. King,United States,,false,false,true,https://www.tysonfoods.com,,USD,133000,Springdale,AR,(479) 290-4000,2200 West Don Tyson Parkway,3.34,2026-06-02T05:13:45+00:00,2026-06-01T05:27:45+00:00,Equity
PPC,Pilgrim's Pride Corporation,28.790001,6735569920,1242300,1205285,27.77,27.76,28.860001,28.790001,0.480001,1.695519,28.309999,2026-06-02,,,0.347,237921941,7.589812,3.73,Consumer Defensive,Packaged Foods,"Pilgrim's Pride Corporation produces, processes, markets, and distributes fresh, frozen, and value-added chicken and pork products to retailers, distributors, and foodservice operators in the United States, Europe, and Mexico. The company offers fresh products, including refrigerated whole or cut-up chicken, selected chicken parts that are either marinated or non-marinated, primary pork cuts, added value pork, pork ribs, and lamb products; and prepared products, which include fully cooked, ready-to-cook and individually frozen chicken parts, strips, nuggets and patties, processed sausages, bacon, smoked meat, gammon joints, pre-packed meats, sandwich and deli counter meats, and meat balls and coated foods. It also provides plant-based protein, ready-to-eat meals, multi-protein frozen food, vegetarian food, and desserts. In addition, its exported products include whole chickens and chicken parts for distributors in the U.S. or frozen for distribution to export markets and primary pork cuts, hog heads, and trotters frozen for distribution. The company offers its products under the Pilgrim's, Just BARE, Gold'n Pump, Gold Kist, County Pride, Pierce Chicken, Pilgrim's Mexico, To-Ricos, Del Dia, Moy Park, Matteson's, Richmond, Fridge Raiders, and Denny brands. It serves chain restaurants, food processors, broad-line distributors, and other institutions; and retail market, such as grocery store chains, wholesale clubs, and other retail distributors. The company was founded in 1946 and is headquartered in Greeley, Colorado. Pilgrim's Pride Corporation operates as a subsidiary of JBS N.V.",NMS,Mr. Fabio  Sandri,United States,,false,false,true,https://www.pilgrims.com,,USD,63000,Greeley,CO,970 506 8000,1770 Promontory Circle,,2026-06-02T05:13:46+00:00,2026-06-01T05:27:46+00:00,Equity
HRL,Hormel Foods Corporation,23.35,12783815680,6428600,5352598,23.23,23.030001,23.4,23.35,0.120001,0.516577,23.23,2026-06-02,,,0.313,550314959,27.32941,0.85,Consumer Defensive,Packaged Foods,"Hormel Foods Corporation develops, processes, and distributes various meat, nuts, and other food products to foodservice, convenience store, and commercial customers in the United States and internationally. It operates through three segments: Retail, Foodservice, and International segments. The company provides various perishable products, including resh meats, frozen items, refrigerated meal solutions, bacon, sausages, hams, guacamole, and other items that require refrigeration; and shelf-stable products, such as canned luncheon meats, nut butters, snack nuts, chili, shelf-stable microwaveable meals, hash, stews, tortillas, salsas, tortilla chips, and other items that do not require refrigeration. It sells its products under the HORMEL, ALWAYS TENDER, APPLEGATE, AUSTIN BLUES, BACON 1, BLACK LABEL, BREAD READY, BURKE, CAFÉ H, CERATTI, CHI-CHI'S, COLUMBUS, COMPLEATS, CORN NUTS, CURE 81, DAN'S PRIZE, DI LUSSO, DINTY MOORE, DON MIGUEL, DOÑA MARIA, EMBASA, FAST N EASY, FIRE BRAISED, FONTANINI, HERDEZ, HORMEL GATHERINGS, HOUSE OF TSANG, JENNIE-O, JUSTIN'S, LA VICTORIA, LAYOUT, LLOYD'S, MARY KITCHEN, MR. PEANUT, NATURAL CHOICE, NUT-RITION, OLD SMOKEHOUSE, OVEN READY, PILLOW PACK, PLANTERS, ROSA GRANDE, SADLER'S SMOKEHOUSE, SKIPPY, SPAM, SQUARE TABLE, SPECIAL RECIPE, VALLEY FRESH, and WHOLLY brands through sales personnel, independent brokers, and distributors. The company was formerly known as Geo. A. Hormel & Company and changed its name to Hormel Foods Corporation in January 1995. Hormel Foods Corporation was founded in 1891 and is headquartered in Austin, Minnesota.",NYQ,Mr. Jeffrey M. Ettinger,United States,,false,false,true,https://www.hormelfoods.com,,USD,20000,Austin,MN,507 437 5611,1 Hormel Place,5.04,2026-06-02T05:13:46+00:00,2026-06-01T05:27:46+00:00,Equity
IPAR,"Interparfums, Inc.",92.400002,3022273024,351900,265928,95.010002,90.589996,96.199997,92.400002,-1.970001,-2.087529,94.370003,2026-06-02,,,1.18,32025781,17.90702,5.27,Consumer Defensive,Household & Personal Products,"Interparfums, Inc., together with its subsidiaries, manufactures, markets, and distributes a range of fragrances and fragrance related products in the United States and internationally. It operates in two segments, European Based Operations and United States Based Operations. The company offers its fragrance and cosmetic products under the Boucheron, Coach, Jimmy Choo, Karl Lagerfeld, Kate Spade, Lanvin, Moncler, Montblanc, Rochas, Longchamp, Off-White, Van Cleef & Arpels, Abercrombie & Fitch, Anna Sui, Donna Karan, DKNY, Emanuel Ungaro, Ferragamo, Graff, GUESS, Hollister, MCM, Oscar de la Renta, Ungaro, and Roberto Cavalli brands, as well as French Connection, Intimate, Solférino, Tristar, and Lacoste trademarks. It sells its products to department stores, perfumeries, specialty stores, duty free shops, and domestic and international wholesalers and distributors, as well as through e-commerce sites. The company was formerly known as Jean Philippe Fragrances, Inc. and changed its name to Inter Parfums, Inc. in July 1999. Interparfums, Inc. was founded in 1982 and is headquartered in New York, New York.",NMS,Mr. Jean  Madar,United States,,false,false,true,https://www.interparfumsinc.com,,USD,662,New York,NY,212 983 2640,551 Fifth Avenue,3.39,2026-06-02T05:13:47+00:00,2026-06-01T05:27:47+00:00,Equity
SPB,"Spectrum Brands Holdings, Inc.",77.760002,1825159424,257900,361122,77.660004,76.169998,78.269997,77.760002,-0.93,-1.181853,78.690002,2026-06-02,,,0.669,23194298,15.369142,5.12,Consumer Defensive,Household & Personal Products,"Spectrum Brands Holdings, Inc. operates as a branded consumer products and home essentials company in North America, Europe, the Middle East, Africa, Latin America, and Asia-Pacific regions. The company operates through three segments: Home and Personal Care (HPC); Global Pet Care (GPC); and Home and Garden (H&G). The Home and Personal Care segment provides home appliances under the Black & Decker, Russell Hobbs, George Foreman, PowerXL, Emeril Legasse, Copper Chef, Juiceman, and Breadman brands; and personal care products under the Remington brand. The GPC segment provides Rawhide chews, dog and cat clean-up, training, health and grooming products, small animal food and care products, rawhide-free dog and cat treats, and wet and dry pet food for dogs and cats under the Good'n'Fun, DreamBone, Good Boy, SmartBones, IAMS, EUKANUBA, Nature's Miracle, FURminator, Dingo, 8IN1, Better Belly, Meowee!, and Wild Harvest brands. This segment also offers aquarium kits, stand-alone tanks, and aquatics equipment and consumables under the Tetra, Marineland, Instant Ocean, GloFish, and OmegaSea brands. The H&G segment provides outdoor insect and weed control solutions, and animal repellents under the Spectracide, Garden Safe, Liquid Fence, and EcoLogic brands; household pest control solutions under the Hot Shot and Black Flag brands; household surface cleaning, maintenance, and restoration products, including bottled liquids, mops, wipes, and markers under the Rejuvenate brand; and personal-use pesticides and insect repellent products under the Cutter and Repel brands. It sells its products through retailers, e-commerce and online retailers, wholesalers, and distributors. Spectrum Brands Holdings, Inc. was founded in 1906 and is based in Middleton, Wisconsin.",NYQ,Mr. David M. Maura C.F.A.,United States,,false,false,true,https://www.spectrumbrands.com,,USD,3000,Middleton,WI,608 275 3340,3001 Deming Way,2.39,2026-06-02T05:13:48+00:00,2026-06-01T05:27:48+00:00,Equity
SJM,The J. M. Smucker Company,100.610001,11006106624,1489100,1916992,102.559998,100.279999,102.800003,100.610001,-2.589996,-2.509686,103.199997,2026-06-02,,,0.245,106648319,,-11.79,Consumer Defensive,Packaged Foods,"The J. M. Smucker Company manufactures and markets branded food and beverage products worldwide. The company operates through four segments: U.S. Retail Coffee, U.S. Retail Frozen Handheld and Spreads, U.S. Retail Pet Foods, and Sweet Baked Snacks. It offers coffee, sweet baked goods, pet snacks, frozen handheld products, peanut butter, cat and dog food, fruit and specialty spreads, cookies, frozen sandwiches and snacks, hot beverages, portion control products, toppings and syrups, baking mixes and ingredients, and flour. The company provides its products under the Folgers, Café Bustelo, Dunkin', Jif, Smucker's, Smucker's Uncrustables, Meow Mix, Milk-Bone, Pup-Peroni, Canine Carry Outs, Hostess, 1850, Robin Hood, and Five Roses brands. The company sells its products through direct sales and brokers to food retailers, club stores, discount and dollar stores, online retailers, pet specialty stores, distributors, drug stores, military commissaries, mass merchandisers, supermarket chains, national mass retailers, convenience stores, vending channels, and foodservice distributors and operators. The J. M. Smucker Company was founded in 1897 and is headquartered in Orrville, Ohio.",NYQ,Captain Mark T. Smucker,United States,,false,false,true,https://www.jmsmucker.com,,USD,8000,Orrville,OH,330 682 3000,One Strawberry Lane,4.26,2026-06-02T05:13:48+00:00,2026-06-01T05:27:48+00:00,Equity
KR,The Kroger Co.,61.52,38319247360,8255200,6115122,62.599998,61.389999,63,61.52,-0.630001,-1.013678,62.150002,2026-06-02,,,0.457,616560677,40.357143,1.54,Consumer Defensive,Grocery Stores,"The Kroger Co. operates as a food and drug retailer in the United States. The company operates combination food and drug stores, multi-department stores, marketplace stores, and price impact warehouses. Its combination food and drug stores offer natural food and organic sections, pharmacies, general merchandise, pet centers, fresh seafood, and organic produce; and its multi-department stores provide apparel, home fashion and furnishings, outdoor living, electronics, automotive products, and toys. The company's marketplace stores offer full-service grocery, pharmacy, health and beauty care, and perishable goods, as well as general merchandise, including apparel, home goods, and toys; and its price impact warehouse stores provide grocery, and health and beauty care items, as well as meat, dairy, baked goods, and fresh produce items. It also manufactures and processes food products for sale in its supermarkets and online; and sells fuel through its fuel centers. The company sells its products through its stores, fuel centers, and online platforms. The Kroger Co. was founded in 1883 and is based in Cincinnati, Ohio.",NYQ,Mr. David John Christopher Kennerley,United States,,false,false,true,https://www.thekrogerco.com,,USD,403000,Cincinnati,OH,513 762 4000,1014 Vine Street,2.25,2026-06-02T05:13:49+00:00,2026-06-01T05:27:49+00:00,Equity
DPZ,"Domino's Pizza, Inc.",313.709991,10330471424,706900,969744,311.329987,309.170013,315.529999,313.709991,3.130005,1.007793,310.579987,2026-06-02,,,1.02,33261870,17.890553,17.36,Consumer Cyclical,Restaurants,"Domino's Pizza, Inc. operates as a pizza company worldwide. The company operates through three segments: U.S. Stores, International Franchise, and Supply Chain. It offers pizzas under the Domino's brand name through company-owned and franchised stores. The company also provides bread products, wings, boneless chicken, pastas, oven-baked sandwiches, soft drink products and desserts. In addition, it offers parmesan stuffed crust pizza; spicy chicken bacon ranch specialty pizza; and garlic, and cinnamon bread bites, as well as croissant, chocolate volcano, and chicken burst pizzas. Domino's Pizza, Inc. was founded in 1960 and is based in Ann Arbor, Michigan.",NMS,Mr. David Allen Brandon,United States,2025-01-02,false,false,true,https://biz.dominos.com,,USD,6200,Ann Arbor,MI,734 930 3030,30 Frank Lloyd Wright Drive,2.56,2026-06-02T05:13:49+00:00,2026-06-01T05:27:50+00:00,Equity
CRUS,"Cirrus Logic, Inc.",167.729996,8596561920,575200,624969,167.729996,167.410004,172,167.729996,-2.220001,-1.306267,169.949997,2026-06-02,,,1.154,50582893,21.649681,7.85,Technology,Semiconductors,"Cirrus Logic, Inc., a fabless semiconductor company, develops mixed-signal processing solutions and audio products in China, the United States, and internationally. The company offers audio products, including amplifiers; codecs components that integrate analog-to-digital converters (ADCs) and digital-to-analog converters (DACs) into a single integrated circuit (IC); smart codecs, a codec with integrated digital signal processing; standalone digital signal processors; and SoundClear technology for use in smartphones, PCs, tablets, AR/VR headsets, wearables, home theatre systems, automotive entertainment systems, and professional audio systems. It also provides camera controllers, haptic and sensing solutions, and battery and power ICs for smartphones, as well as products for automotive, industrial, and imaging applications. The company markets and sells its products through direct sales force, external sales representatives, and distributors. Cirrus Logic, Inc. was incorporated in 1984 and is headquartered in Austin, Texas.",NMS,Mr. John M. Forsyth,United States,,false,false,true,https://www.cirrus.com,,USD,1651,Austin,TX,512 851 4000,800 West 6th Street,,2026-06-02T05:13:49+00:00,2026-06-01T05:27:50+00:00,Equity
SWKS,"Skyworks Solutions, Inc.",75.489998,11709104128,4866800,3958747,77.800003,74.160004,77.809998,75.489998,-2.360001,-3.031472,77.849998,2026-06-02,,,1.476,150405963,32.437496,2.4,Technology,Semiconductors,"Skyworks Solutions, Inc., together with its subsidiaries, develops, manufactures, and markets analog and mixed-signal semiconductor products and solutions in the United States, Taiwan, China, South Korea, Europe, the Middle East, Africa, and the Asia Pacific. The company offers amplifiers, antenna tuners, attenuators, automotive tuners and digital radios, wireless ASoC, DC/DC converters, demodulators, detectors, digital power isolators, diodes, directional couplers, diversity receive modules, filters, front-end modules, hybrids, light emitting diode drivers, low noise amplifiers, mixers, modulators, and optocouplers/optoisolators. It also provides phase locked loops, phase shifters, power dividers/combiners, power over ethernet, power isolators, ProSLIC family of subscriber line interface circuits, receivers, system in package, switches, synthesizers, timing devices, voltage-controlled oscillators/synthesizers, and voltage regulators. The company sells its products through direct sales force, electronic component distributors, and independent sales representatives. Its products are used in aerospace, automotive, broadband, cellular infrastructure, connected home, defense, entertainment and gaming, industrial, medical, smartphone, tablet, and wearables applications. The company was founded in 1962 and is headquartered in Irvine, California.",NMS,Mr. Philip Gordon Brace,United States,,false,false,true,https://www.skyworksinc.com,,USD,10000,Irvine,CA,949 231 3000,5260 California Avenue,3.65,2026-06-02T05:13:50+00:00,2026-06-01T05:27:50+00:00,Equity
QRVO,"Qorvo, Inc.",99.970001,9114695680,1113900,1207801,102.900002,99.345001,102.910004,99.970001,-3.589996,-3.466586,103.559998,2026-06-02,,,1.42,88013673,28.607735,3.62,Technology,Semiconductors,"Qorvo, Inc. engages in development and commercialization of technologies and products for wireless, wired, and power markets in the United States, China, rest of Asia, Taiwan, and Europe. It operates through three segments: High Performance Analog (HPA), Connectivity and Sensors Group (CSG), and Advanced Cellular Group (ACG). The HPA segment supplies radio frequency, analog mixed signal, and power management solutions for defense and aerospace markets, as well as offers compound semiconductor foundry services, wafer processing, advanced packaging and heterogeneous integration solutions. The CSG segment supplies connectivity and sensor solutions featuring various technologies, such as UWB, Matter, Bluetooth Low Energy, Zigbee, Thread, Wi-Fi, and cellular solutions. It serves smart home, industrial automation, automotive, smartphones, wearables, gaming, and industrial and enterprise access points markets. The ACG segment supplies cellular solutions for smartphones, wearables, laptops, tablets, and various other devices. It also offers foundry services for defense primes and other defense and aerospace customers. The company sells its products directly to original equipment manufacturers and original design manufacturers, as well as through a network of sales representative firms and distributors. Qorvo, Inc. was founded in 1957 and is headquartered in Greensboro, North Carolina.",NMS,Mr. Robert A. Bruggeworth,United States,,false,false,true,https://www.qorvo.com,,USD,5200,Greensboro,NC,336 664 1233,7628 Thorndike Road,,2026-06-02T05:13:50+00:00,2026-06-01T05:27:51+00:00,Equity
LPL,"LG Display Co., Ltd.",5.51,5550000128,2429700,2011641,5.3,5.26,5.66,5.51,-0.04,-0.72072,5.55,2026-06-02,,,1.122,1000000000,,-0.05,Technology,Consumer Electronics,"LG Display Co., Ltd., together with its subsidiaries, engages in the research, development, manufacture, and sale of organic light-emitting diode (OLED) and thin-film transistor liquid crystal display (TFT-LCD) panels in South Korea, China, the rest of Asia, North America, and Europe. The company offers display panels for televisions; monitors; IT products comprising notebook computers, desktop monitors, and tablet computers; laptops; smartphones and smartwatches; mobile phones and watches; automobiles; and other products with display devices. It also engages in the operation and management of welfare facilities; management of intellectual properties; production and sale of LCD modules and monitor sets; and investment in venture businesses and technologies. The company exports its products. The company was formerly known as LG.Philips LCD CO., Ltd. and changed its name to LG Display Co., Ltd. in March 2008. LG Display Co., Ltd. was incorporated in 1985 and is headquartered in Seoul, South Korea.",NYQ,Mr. Chul-Dong  Jeong,South Korea,,false,false,true,https://www.lgdisplay.com,,USD,,Seoul,,82 2 3777 1010,LG Twin Towers,,2026-06-02T05:13:50+00:00,2026-06-01T05:27:51+00:00,Equity
